{"k":"beam_response_map","v":1,"generated_t":1793000000.0,"inputs":{"spatial_rows":4800,"t_first":1699920000.0,"t_last":1699924799.0,"bands_rows":4800,"bands_dropped":0,"rotated_read":false},"params":{"min_conf":0.85,"min_events":30,"max_spread_db":30.0,"baseline_s":900.0,"min_baseline_windows":50,"join_before_s":2.0,"join_after_s":0.0,"controls":200,"exclude_s":10.0,"seed":1,"boot":200,"perms":200,"cluster_gap_s":86400.0,"bout_gap_s":60.0,"min_bouts":10,"speech_guard_s":5.0,"bands_max_rows":60000,"thresholds":{"a1_min_db":1.0,"a1_control_factor":3.0,"r_min":0.5,"alpha":0.01,"tests":12,"alpha_adjusted":0.000833333333}},"filters":{"spread_over_max":0,"bad_vector":0,"no_baseline":0,"bad_json":0},"segments":[{"label":"all","t_first":1699920000.0,"t_last":1699924799.0,"rows":4800}],"epochs":null,"skipped_sources":[{"name":"Engine","reason":"non_biological"}],"sources":[{"name":"Barn Owl","band":"spatial_200_4000","kind":"species","suspected_artifact":false,"events":40,"epochs":[{"label":"all","events":40,"joined":40,"unjoined":0,"events_no_baseline":0,"bouts":40,"event_duty":0.025,"baseline_contaminated":false,"dominant_hist":[0,40,0,0,0,0,0,0],"control_dominant_hist":[17,15,24,23,34,37,17,33],"ratio_by_dominant":[{"beam":2,"n":40,"to_next_db":{"p10":1.120867,"p25":1.155062,"p50":1.165229,"p75":1.20625,"p90":1.229929},"to_prev_db":{"p10":1.1246,"p25":1.144708,"p50":1.1715,"p75":1.194083,"p90":1.223304}}],"top2_db":{"p25":1.12874,"p50":1.15875,"p75":1.182042},"a1_db":{"p25":3.987939,"p50":3.998109,"p75":4.007286,"p95":4.01809},"a1_ci95":[3.994279,4.004841],"phase_deg":45.03,"R":0.999994,"rayleigh_p":0.0,"perm_p":0.004975,"control":{"n":200,"a1_db":{"p25":0.011662,"p50":0.017514,"p75":0.02431,"p95":0.035343},"top2_db":{"p25":0.005521,"p50":0.012562,"p75":0.025052}},"lag_scan":[{"shift_s":-10,"median_a1_db":0.017655},{"shift_s":-9,"median_a1_db":0.014338},{"shift_s":-8,"median_a1_db":0.015113},{"shift_s":-7,"median_a1_db":0.015158},{"shift_s":-6,"median_a1_db":0.017905},{"shift_s":-5,"median_a1_db":0.016579},{"shift_s":-4,"median_a1_db":0.017695},{"shift_s":-3,"median_a1_db":0.016589},{"shift_s":-2,"median_a1_db":1.335937},{"shift_s":-1,"median_a1_db":2.665952},{"shift_s":0,"median_a1_db":3.998109},{"shift_s":1,"median_a1_db":2.664766},{"shift_s":2,"median_a1_db":1.334492},{"shift_s":3,"median_a1_db":0.019721},{"shift_s":4,"median_a1_db":0.017522},{"shift_s":5,"median_a1_db":0.016693},{"shift_s":6,"median_a1_db":0.020739},{"shift_s":7,"median_a1_db":0.016194},{"shift_s":8,"median_a1_db":0.02019},{"shift_s":9,"median_a1_db":0.018571},{"shift_s":10,"median_a1_db":0.014558}],"verdict":"go","reason":"median A1 4.00 dB >= 1.00 dB, R 1.00, Rayleigh p 2.2e-30 < 0.00083"}],"verdict":"go","reason":"median A1 4.00 dB >= 1.00 dB, R 1.00, Rayleigh p 2.2e-30 < 0.00083"},{"name":"Barn Owl","band":"b_50_125","kind":"species","suspected_artifact":false,"events":40,"epochs":[],"verdict":"identical_expected","reason":"bands below 500 Hz: the beams are identical there (MSC 0.98-1.00)"},{"name":"Barn Owl","band":"b_125_250","kind":"species","suspected_artifact":false,"events":40,"epochs":[],"verdict":"identical_expected","reason":"bands below 500 Hz: the beams are identical there (MSC 0.98-1.00)"},{"name":"Barn Owl","band":"b_250_500","kind":"species","suspected_artifact":false,"events":40,"epochs":[],"verdict":"identical_expected","reason":"bands below 500 Hz: the beams are identical there (MSC 0.98-1.00)"},{"name":"Barn Owl","band":"b_500_1000","kind":"species","suspected_artifact":false,"events":40,"epochs":[{"label":"all","events":40,"joined":40,"unjoined":0,"events_no_baseline":0,"bouts":40,"event_duty":0.025,"baseline_contaminated":false,"dominant_hist":[4,8,5,8,4,4,2,5],"control_dominant_hist":[34,25,17,26,20,26,18,34],"ratio_by_dominant":[{"beam":2,"n":8,"to_next_db":{"p10":0.028942,"p25":0.037854,"p50":0.052187,"p75":0.065531,"p90":0.079175},"to_prev_db":{"p10":0.026937,"p25":0.049688,"p50":0.062417,"p75":0.073281,"p90":0.088913}},{"beam":3,"n":5,"to_next_db":{"p10":0.014517,"p25":0.017792,"p50":0.026958,"p75":0.0485,"p90":0.050575},"to_prev_db":{"p10":0.019958,"p25":0.040833,"p50":0.048625,"p75":0.067375,"p90":0.074625}},{"beam":4,"n":8,"to_next_db":{"p10":0.025821,"p25":0.035833,"p50":0.043958,"p75":0.082193,"p90":0.113202},"to_prev_db":{"p10":0.011004,"p25":0.032385,"p50":0.053667,"p75":0.083432,"p90":0.092898}},{"beam":8,"n":5,"to_next_db":{"p10":0.014208,"p25":0.022458,"p50":0.053417,"p75":0.066958,"p90":0.103258},"to_prev_db":{"p10":0.020908,"p25":0.043083,"p50":0.046292,"p75":0.077917,"p90":0.094667}}],"top2_db":{"p25":0.006104,"p50":0.015396,"p75":0.027094},"a1_db":{"p25":0.011154,"p50":0.017071,"p75":0.021182,"p95":0.032032},"a1_ci95":[0.014039,0.019311],"phase_deg":70.611,"R":0.079452,"rayleigh_p":0.778978780915,"perm_p":0.422886,"control":{"n":200,"a1_db":{"p25":0.010946,"p50":0.01628,"p75":0.023561,"p95":0.034154},"top2_db":{"p25":0.006083,"p50":0.014437,"p75":0.024786}},"lag_scan":[{"shift_s":-10,"median_a1_db":0.014007},{"shift_s":-9,"median_a1_db":0.018029},{"shift_s":-8,"median_a1_db":0.015379},{"shift_s":-7,"median_a1_db":0.018941},{"shift_s":-6,"median_a1_db":0.018207},{"shift_s":-5,"median_a1_db":0.018915},{"shift_s":-4,"median_a1_db":0.01882},{"shift_s":-3,"median_a1_db":0.018387},{"shift_s":-2,"median_a1_db":0.019913},{"shift_s":-1,"median_a1_db":0.015936},{"shift_s":0,"median_a1_db":0.017071},{"shift_s":1,"median_a1_db":0.015337},{"shift_s":2,"median_a1_db":0.015043},{"shift_s":3,"median_a1_db":0.013522},{"shift_s":4,"median_a1_db":0.01656},{"shift_s":5,"median_a1_db":0.016983},{"shift_s":6,"median_a1_db":0.017409},{"shift_s":7,"median_a1_db":0.016547},{"shift_s":8,"median_a1_db":0.016306},{"shift_s":9,"median_a1_db":0.018964},{"shift_s":10,"median_a1_db":0.017031}],"verdict":"no_go","reason":"median A1 0.02 dB vs threshold 1.00 dB (control p95 0.03), R 0.08, Rayleigh p 0.78"}],"verdict":"no_go","reason":"median A1 0.02 dB vs threshold 1.00 dB (control p95 0.03), R 0.08, Rayleigh p 0.78"},{"name":"Barn Owl","band":"b_1000_2000","kind":"species","suspected_artifact":false,"events":40,"epochs":[{"label":"all","events":40,"joined":40,"unjoined":0,"events_no_baseline":0,"bouts":40,"event_duty":0.025,"baseline_contaminated":false,"dominant_hist":[2,1,7,6,8,4,4,8],"control_dominant_hist":[26,35,37,16,12,24,37,13],"ratio_by_dominant":[{"beam":3,"n":7,"to_next_db":{"p10":0.023925,"p25":0.042833,"p50":0.059167,"p75":0.066958,"p90":0.080408},"to_prev_db":{"p10":0.02705,"p25":0.045062,"p50":0.059833,"p75":0.065542,"p90":0.07765}},{"beam":4,"n":6,"to_next_db":{"p10":0.021167,"p25":0.025052,"p50":0.034542,"p75":0.042937,"p90":0.048021},"to_prev_db":{"p10":0.0255,"p25":0.030781,"p50":0.034271,"p75":0.03576,"p90":0.039938}},{"beam":5,"n":8,"to_next_db":{"p10":0.035487,"p25":0.040969,"p50":0.055021,"p75":0.067333,"p90":0.071646},"to_prev_db":{"p10":0.007229,"p25":0.014073,"p50":0.052146,"p75":0.075469,"p90":0.098262}},{"beam":8,"n":8,"to_next_db":{"p10":0.012013,"p25":0.017781,"p50":0.05125,"p75":0.059458,"p90":0.080808},"to_prev_db":{"p10":0.003996,"p25":0.006865,"p50":0.010562,"p75":0.062917,"p90":0.089454}}],"top2_db":{"p25":0.006583,"p50":0.011604,"p75":0.021156},"a1_db":{"p25":0.011792,"p50":0.015334,"p75":0.018749,"p95":0.025928},"a1_ci95":[0.014233,0.018137],"phase_deg":-120.619,"R":0.288451,"rayleigh_p":0.034852701775,"perm_p":0.78607,"control":{"n":200,"a1_db":{"p25":0.012026,"p50":0.017351,"p75":0.025127,"p95":0.033867},"top2_db":{"p25":0.004615,"p50":0.01175,"p75":0.022146}},"lag_scan":[{"shift_s":-10,"median_a1_db":0.017145},{"shift_s":-9,"median_a1_db":0.015861},{"shift_s":-8,"median_a1_db":0.014889},{"shift_s":-7,"median_a1_db":0.017595},{"shift_s":-6,"median_a1_db":0.017234},{"shift_s":-5,"median_a1_db":0.016926},{"shift_s":-4,"median_a1_db":0.015295},{"shift_s":-3,"median_a1_db":0.020082},{"shift_s":-2,"median_a1_db":0.015585},{"shift_s":-1,"median_a1_db":0.014269},{"shift_s":0,"median_a1_db":0.015334},{"shift_s":1,"median_a1_db":0.014942},{"shift_s":2,"median_a1_db":0.018548},{"shift_s":3,"median_a1_db":0.011685},{"shift_s":4,"median_a1_db":0.015926},{"shift_s":5,"median_a1_db":0.017047},{"shift_s":6,"median_a1_db":0.016182},{"shift_s":7,"median_a1_db":0.014997},{"shift_s":8,"median_a1_db":0.014952},{"shift_s":9,"median_a1_db":0.016072},{"shift_s":10,"median_a1_db":0.01819}],"verdict":"no_go","reason":"median A1 0.02 dB vs threshold 1.00 dB (control p95 0.03), R 0.29, Rayleigh p 0.035"}],"verdict":"no_go","reason":"median A1 0.02 dB vs threshold 1.00 dB (control p95 0.03), R 0.29, Rayleigh p 0.035"},{"name":"Barn Owl","band":"b_2000_4000","kind":"species","suspected_artifact":false,"events":40,"epochs":[{"label":"all","events":40,"joined":40,"unjoined":0,"events_no_baseline":0,"bouts":40,"event_duty":0.025,"baseline_contaminated":false,"dominant_hist":[8,6,6,5,4,3,4,4],"control_dominant_hist":[23,23,26,30,24,22,32,20],"ratio_by_dominant":[{"beam":1,"n":8,"to_next_db":{"p10":0.0333,"p25":0.039,"p50":0.057896,"p75":0.073583,"p90":0.083577},"to_prev_db":{"p10":0.024715,"p25":0.046552,"p50":0.054688,"p75":0.070646,"p90":0.086596}},{"beam":2,"n":6,"to_next_db":{"p10":0.016687,"p25":0.028182,"p50":0.058302,"p75":0.076359,"p90":0.10299},"to_prev_db":{"p10":0.01674,"p25":0.026281,"p50":0.04951,"p75":0.064552,"p90":0.092083}},{"beam":3,"n":6,"to_next_db":{"p10":0.006458,"p25":0.014833,"p50":0.040083,"p75":0.073802,"p90":0.088458},"to_prev_db":{"p10":0.04025,"p25":0.043635,"p50":0.055979,"p75":0.066885,"p90":0.080917}},{"beam":4,"n":5,"to_next_db":{"p10":0.008733,"p25":0.018208,"p50":0.06275,"p75":0.083604,"p90":0.095217},"to_prev_db":{"p10":0.015208,"p25":0.034458,"p50":0.042917,"p75":0.044667,"p90":0.085867}}],"top2_db":{"p25":0.003906,"p50":0.013521,"p75":0.021583},"a1_db":{"p25":0.01572,"p50":0.019059,"p75":0.024779,"p95":0.034548},"a1_ci95":[0.017092,0.024077],"phase_deg":-64.781,"R":0.079148,"rayleigh_p":0.780467237192,"perm_p":0.094527,"control":{"n":200,"a1_db":{"p25":0.010539,"p50":0.016479,"p75":0.02371,